{
  "contract": {
    "id": "CT-DEC-002",
    "version": "1.0.0"
  },
  "decision_record_id": "DREC-2026-000001",
  "request_id": "REQ-2026-000001",
  "decision_definition_id": "DEC-SEO-001",
  "subject": {
    "component": "seo_title",
    "location": null
  },
  "result": "revise",
  "rationale": "順位に比べCTRが低く、本文の主回答をより明確に示せるため。",
  "evidence": [
    "CTR 0.2%",
    "平均順位10.0"
  ],
  "confidence": "high",
  "risks": [
    "既存の主要語を失う可能性"
  ],
  "required_actions": [
    "主要語を維持して候補を作る"
  ],
  "prohibited_actions": [
    "本文にない効果を追加しない"
  ],
  "selected_pattern_categories": [
    "seo"
  ],
  "manual_review_required": false,
  "created_at": "2026-07-17T04:01:00+09:00"
}
